{
  "schemaVersion": "1.0.0",
  "generatedAt": "2026-02-21T19:42:00.000Z",
  "source": {
    "assistant": "chatgpt",
    "model": "gpt-5",
    "notes": "Avant-garde chaos style pack with anti-design, glitch, op-art, maximalism, and vaporwave influences."
  },
  "formData": {
    "name": "Chaos Lab",
    "nameEn": "Avant Garde Chaos Lab",
    "slug": "chaos-lab-submission-20260221a",
    "description": "High-impact avant-garde style that blends anti-design, glitch, op-art, maximalism, and vaporwave cues.",
    "category": "expressive",
    "styleType": "visual",
    "tags": ["expressive", "high-contrast", "brand-inspired", "responsive"],
    "primaryColor": "#ff00a8",
    "secondaryColor": "#00e5ff",
    "accentColors": ["#ffff00", "#7c00ff", "#00ff66"],
    "background": "#0a0a0a",
    "foreground": "#f5f5f5",
    "muted": "#7d7d7d",
    "keywords": [
      "anti-design",
      "glitch",
      "op-art",
      "maximalism",
      "vaporwave",
      "neon",
      "chaos",
      "avant-garde"
    ],
    "philosophy": "Break visual comfort, maximize contrast, and keep interaction intensity consistently high.",
    "headingFont": "Orbitron, Noto Sans SC, sans-serif",
    "bodyFont": "JetBrains Mono, Noto Sans SC, monospace",
    "fontSizeBase": "1rem",
    "fontSizeHeading": "2.75rem",
    "fontSizeSmall": "0.875rem",
    "fontWeightNormal": "400",
    "fontWeightBold": "900",
    "lineHeightNormal": "1.6",
    "lineHeightTight": "1.1",
    "borderRadius": "0.5rem",
    "spacingSm": "0.5rem",
    "spacingMd": "1rem",
    "spacingLg": "2rem",
    "doList": [
      "Prioritize visual shock and contrast.",
      "Make hover, active, and focus states aggressive.",
      "Keep glitch-like behavior consistent across core components."
    ],
    "dontList": [
      "Do not soften colors into neutral palettes.",
      "Do not use overly gentle transitions.",
      "Do not revert to standard enterprise UI patterns."
    ],
    "aiRules": [
      "[WARNING] STYLE: Avant Garde Chaos Lab",
      "Allow misalignment, skew, border jumps, and hard-cut transitions.",
      "Use saturated neon highlights and glitch-like shadow offsets.",
      "All components must include strong hover, active, and focus deltas."
    ],
    "buttonCode": "<button className=\"px-8 py-3 bg-[#ff005d] text-white font-black uppercase border-[3px] border-black hover:bg-[#00ff66] hover:text-[#ff005d] hover:border-[8px] hover:-translate-x-3 hover:translate-y-2 hover:rotate-[-5deg] active:translate-x-[10px] active:-translate-y-[10px] active:skew-x-[18deg] transition-none\">CHAOS MODE</button>",
    "cardCode": "<div className=\"group p-8 bg-[#0b0018] border-l-8 border-[#ff00a8] border-b-4 border-[#00e5ff] hover:scale-110 hover:-rotate-2 transition-none\"><h3 className=\"text-4xl font-black uppercase text-[#00e5ff] group-hover:text-[#ff00a8]\">VISUAL OVERLOAD</h3><p className=\"mt-4 text-[#f5f5f5] font-bold\">Break alignment, break comfort, keep the audience staring.</p></div>",
    "inputCode": "<input className=\"w-full px-4 py-3 bg-[#111111] text-[#f8f8f8] border-4 border-[#ff00a8] focus:border-[#00ff66] focus:-translate-x-1 focus:translate-y-1 transition-none\" placeholder=\"TYPE INTO THE NOISE...\" />"
  },
  "assets": {
    "coverSvg": "<svg xmlns=\"http://www.w3.org/2000/svg\" viewBox=\"0 0 1200 630\" role=\"img\" aria-label=\"Chaos Lab cover\"><defs><linearGradient id=\"bg\" x1=\"0\" y1=\"0\" x2=\"1\" y2=\"1\"><stop offset=\"0%\" stop-color=\"#0a0a0a\"/><stop offset=\"55%\" stop-color=\"#2a004e\"/><stop offset=\"100%\" stop-color=\"#001b2f\"/></linearGradient></defs><rect width=\"1200\" height=\"630\" fill=\"url(#bg)\"/><g opacity=\"0.85\"><path d=\"M0 90h1200\" stroke=\"#ff00a8\" stroke-width=\"8\"/><path d=\"M0 150h1200\" stroke=\"#00e5ff\" stroke-width=\"4\"/><path d=\"M0 210h1200\" stroke=\"#ffff00\" stroke-width=\"2\"/></g><text x=\"72\" y=\"300\" fill=\"#f5f5f5\" font-size=\"84\" font-family=\"Orbitron, Arial, sans-serif\" font-weight=\"800\">CHAOS LAB</text><text x=\"72\" y=\"372\" fill=\"#00e5ff\" font-size=\"34\" font-family=\"JetBrains Mono, monospace\" font-weight=\"700\">ANTI-DESIGN / GLITCH / OP-ART / MAXIMALISM / VAPORWAVE</text></svg>"
  },
  "selfCheck": {
    "schemaValid": true,
    "requiredFilesPrepared": ["manifest.json", "cover.svg", "self-check.md"],
    "componentCoverage": ["buttonCode", "cardCode", "inputCode"],
    "notes": "All required top-level fields are present and component snippets are included."
  }
}
